{
  "contribution_role_record_id": "implementation.contribution_role.authorization.schema_admission_boundary",
  "recorded_at": "2026-04-15",
  "role_type": "AUTHORIZATION",
  "matter_ref": "implementation.contribution_role.schema_family_admission",
  "artifact_ref": "implementation/CONTRIBUTION_ROLE_SCHEMA_ADMISSION_BOUNDARY.md"
}
